what state high point are higher than that of colorado ?	_answer ( A , ( _state ( A ) , _high_point ( A , B ) , _higher ( B , C ) , _high_point ( D , C ) , _const ( D , _stateid ( colorado ) ) ) )
what is the highest mountain in texas ?	_answer ( A , _highest ( A , ( _mountain ( A ) , _loc ( A , B ) , _const ( B , _stateid ( texas ) ) ) ) )
what are the major citi in texas ?	_answer ( A , ( _major ( A ) , _city ( A ) , _loc ( A , B ) , _const ( B , _stateid ( texas ) ) ) )
what are the state that border the state with the greatest popul ?	_answer ( A , ( _state ( A ) , _next_to ( B , A ) , _largest ( C , ( _state ( B ) , _population ( B , C ) ) ) ) )
what river run through colorado ?	_answer ( A , ( _river ( A ) , _traverse ( A , B ) , _const ( B , _stateid ( colorado ) ) ) )
how mani river are there in us ?	_answer ( A , _count ( B , ( _river ( B ) , _loc ( B , C ) , _const ( C , _countryid ( usa ) ) ) , A ) )
how mani river are in new york ?	_answer ( A , _count ( B , ( _river ( B ) , _loc ( B , C ) , _const ( C , _stateid ( ' new york ' ) ) ) , A ) )
which river are in alaska ?	_answer ( A , ( _river ( A ) , _loc ( A , B ) , _const ( B , _stateid ( alaska ) ) ) )
what is the longest river flow through new york ?	_answer ( A , _longest ( A , ( _river ( A ) , _traverse ( A , B ) , _const ( B , _stateid ( ' new york ' ) ) ) ) )
what river run through west virginia ?	_answer ( A , ( _river ( A ) , _traverse ( A , B ) , _const ( B , _stateid ( ' west virginia ' ) ) ) )
what are the capit of the state that border texas ?	_answer ( A , ( _capital ( A ) , _loc ( A , B ) , _state ( B ) , _next_to ( B , C ) , _const ( C , _stateid ( texas ) ) ) )
what is the area of california ?	_answer ( A , ( _area ( B , A ) , _const ( B , _stateid ( california ) ) ) )
how mani state have a citi name springfield ?	_answer ( A , _count ( B , ( _state ( B ) , _loc ( C , B ) , _const ( C , _cityid ( springfield , _ ) ) ) , A ) )
what is the biggest citi in texas ?	_answer ( A , _largest ( A , ( _city ( A ) , _loc ( A , B ) , _const ( B , _stateid ( texas ) ) ) ) )
how mani citi name austin are there in the usa ?	_answer ( A , _count ( B , ( _city ( B ) , _const ( B , _cityid ( austin , _ ) ) , _loc ( B , C ) , _const ( C , _countryid ( usa ) ) ) , A ) )
